{"$id":"https://github.com/afflom/lexlean/schemas/coverage.schema.json","$schema":"https://json-schema.org/draft/2020-12/schema","additionalProperties":false,"properties":{"latex":{"items":{"additionalProperties":false,"properties":{"byte_end":{"minimum":0,"type":"integer"},"byte_start":{"minimum":0,"type":"integer"},"kind":{"enum":["control","word","symbol","numeral","delimiter","punctuation"]},"origin":{"oneOf":[{"additionalProperties":false,"properties":{"entry":{"minLength":1,"type":"string"},"form":{"minLength":1,"type":"string"},"kind":{"const":"form"},"package":{"minLength":1,"type":"string"}},"required":["entry","form","kind","package"],"type":"object"},{"additionalProperties":false,"properties":{"kind":{"const":"local"},"local":{"minimum":0,"type":"integer"}},"required":["kind","local"],"type":"object"},{"additionalProperties":false,"properties":{"kind":{"const":"numeral"}},"required":["kind"],"type":"object"},{"additionalProperties":false,"properties":{"entry":{"minLength":1,"type":"string"},"kind":{"const":"structural"},"package":{"minLength":1,"type":"string"}},"required":["entry","kind","package"],"type":"object"},{"additionalProperties":false,"properties":{"kind":{"const":"metadata"},"owner":{"minLength":1,"type":"string"}},"required":["kind","owner"],"type":"object"},{"additionalProperties":false,"properties":{"kind":{"const":"renderer-token"},"token":{"minLength":1,"type":"string"}},"required":["kind","token"],"type":"object"},{"additionalProperties":false,"properties":{"component":{"minLength":1,"type":"string"},"kind":{"const":"reference"},"module":{"minLength":1,"type":"string"}},"required":["component","kind","module"],"type":"object"},{"additionalProperties":false,"properties":{"kind":{"const":"synthetic"},"origin":{"minLength":1,"type":"string"}},"required":["kind","origin"],"type":"object"}]}},"required":["byte_end","byte_start","kind","origin"],"type":"object"},"type":"array"},"lean":{"items":{"additionalProperties":false,"properties":{"byte_end":{"minimum":0,"type":"integer"},"byte_start":{"minimum":0,"type":"integer"},"kind":{"enum":["keyword","identifier","numeral","symbol"]},"origin":{"oneOf":[{"additionalProperties":false,"properties":{"entry":{"minLength":1,"type":"string"},"form":{"minLength":1,"type":"string"},"kind":{"const":"form"},"package":{"minLength":1,"type":"string"}},"required":["entry","form","kind","package"],"type":"object"},{"additionalProperties":false,"properties":{"kind":{"const":"local"},"local":{"minimum":0,"type":"integer"}},"required":["kind","local"],"type":"object"},{"additionalProperties":false,"properties":{"kind":{"const":"numeral"}},"required":["kind"],"type":"object"},{"additionalProperties":false,"properties":{"entry":{"minLength":1,"type":"string"},"kind":{"const":"structural"},"package":{"minLength":1,"type":"string"}},"required":["entry","kind","package"],"type":"object"},{"additionalProperties":false,"properties":{"kind":{"const":"metadata"},"owner":{"minLength":1,"type":"string"}},"required":["kind","owner"],"type":"object"},{"additionalProperties":false,"properties":{"kind":{"const":"renderer-token"},"token":{"minLength":1,"type":"string"}},"required":["kind","token"],"type":"object"},{"additionalProperties":false,"properties":{"component":{"minLength":1,"type":"string"},"kind":{"const":"reference"},"module":{"minLength":1,"type":"string"}},"required":["component","kind","module"],"type":"object"},{"additionalProperties":false,"properties":{"kind":{"const":"synthetic"},"origin":{"minLength":1,"type":"string"}},"required":["kind","origin"],"type":"object"}]}},"required":["byte_end","byte_start","kind","origin"],"type":"object"},"type":"array"},"module":{"minLength":1,"type":"string"},"source":{"items":{"additionalProperties":false,"properties":{"binding":{"oneOf":[{"additionalProperties":false,"properties":{"entry":{"minLength":1,"type":"string"},"form":{"minLength":1,"type":"string"},"kind":{"const":"form"},"package":{"minLength":1,"type":"string"}},"required":["entry","form","kind","package"],"type":"object"},{"additionalProperties":false,"properties":{"kind":{"const":"local"},"local":{"minimum":0,"type":"integer"}},"required":["kind","local"],"type":"object"},{"additionalProperties":false,"properties":{"kind":{"const":"numeral"}},"required":["kind"],"type":"object"},{"additionalProperties":false,"properties":{"entry":{"minLength":1,"type":"string"},"kind":{"const":"structural"},"package":{"minLength":1,"type":"string"}},"required":["entry","kind","package"],"type":"object"},{"additionalProperties":false,"properties":{"kind":{"const":"metadata"},"owner":{"minLength":1,"type":"string"}},"required":["kind","owner"],"type":"object"},{"additionalProperties":false,"properties":{"kind":{"const":"renderer-token"},"token":{"minLength":1,"type":"string"}},"required":["kind","token"],"type":"object"},{"additionalProperties":false,"properties":{"component":{"minLength":1,"type":"string"},"kind":{"const":"reference"},"module":{"minLength":1,"type":"string"}},"required":["component","kind","module"],"type":"object"},{"additionalProperties":false,"properties":{"kind":{"const":"synthetic"},"origin":{"minLength":1,"type":"string"}},"required":["kind","origin"],"type":"object"}]},"byte_end":{"minimum":0,"type":"integer"},"byte_start":{"minimum":0,"type":"integer"},"class":{"enum":["control","word","identifier","numeral","delimiter","ascii-symbol","unicode-symbol","whitespace"]},"path":{"minLength":1,"type":"string"}},"required":["binding","byte_end","byte_start","class","path"],"type":"object"},"type":"array"},"spec":{"const":"lexlean/coverage/1"}},"required":["latex","lean","module","source","spec"],"title":"LexLean module coverage record (SPEC.md §20.5, §19.6)","type":"object"}
