{"latex":[{"byte_end":14,"byte_start":0,"kind":"control","origin":{"kind":"renderer-token","token":"documentclass"}},{"byte_end":15,"byte_start":14,"kind":"punctuation","origin":{"kind":"renderer-token","token":"left-bracket"}},{"byte_end":19,"byte_start":15,"kind":"word","origin":{"kind":"renderer-token","token":"opt-11pt"}},{"byte_end":20,"byte_start":19,"kind":"punctuation","origin":{"kind":"renderer-token","token":"right-bracket"}},{"byte_end":21,"byte_start":20,"kind":"delimiter","origin":{"entry":"brace-open","kind":"structural","package":"lexlean.core"}},{"byte_end":28,"byte_start":21,"kind":"word","origin":{"kind":"renderer-token","token":"article"}},{"byte_end":29,"byte_start":28,"kind":"delimiter","origin":{"entry":"brace-close","kind":"structural","package":"lexlean.core"}},{"byte_end":41,"byte_start":30,"kind":"control","origin":{"kind":"renderer-token","token":"usepackage"}},{"byte_end":42,"byte_start":41,"kind":"punctuation","origin":{"kind":"renderer-token","token":"left-bracket"}},{"byte_end":44,"byte_start":42,"kind":"word","origin":{"kind":"renderer-token","token":"opt-t1"}},{"byte_end":45,"byte_start":44,"kind":"punctuation","origin":{"kind":"renderer-token","token":"right-bracket"}},{"byte_end":46,"byte_start":45,"kind":"delimiter","origin":{"entry":"brace-open","kind":"structural","package":"lexlean.core"}},{"byte_end":53,"byte_start":46,"kind":"word","origin":{"kind":"renderer-token","token":"fontenc"}},{"byte_end":54,"byte_start":53,"kind":"delimiter","origin":{"entry":"brace-close","kind":"structural","package":"lexlean.core"}},{"byte_end":66,"byte_start":55,"kind":"control","origin":{"kind":"renderer-token","token":"usepackage"}},{"byte_end":67,"byte_start":66,"kind":"delimiter","origin":{"entry":"brace-open","kind":"structural","package":"lexlean.core"}},{"byte_end":74,"byte_start":67,"kind":"word","origin":{"kind":"renderer-token","token":"amsmath"}},{"byte_end":75,"byte_start":74,"kind":"delimiter","origin":{"entry":"brace-close","kind":"structural","package":"lexlean.core"}},{"byte_end":87,"byte_start":76,"kind":"control","origin":{"kind":"renderer-token","token":"usepackage"}},{"byte_end":88,"byte_start":87,"kind":"delimiter","origin":{"entry":"brace-open","kind":"structural","package":"lexlean.core"}},{"byte_end":95,"byte_start":88,"kind":"word","origin":{"kind":"renderer-token","token":"amssymb"}},{"byte_end":96,"byte_start":95,"kind":"delimiter","origin":{"entry":"brace-close","kind":"structural","package":"lexlean.core"}},{"byte_end":108,"byte_start":97,"kind":"control","origin":{"kind":"renderer-token","token":"usepackage"}},{"byte_end":109,"byte_start":108,"kind":"delimiter","origin":{"entry":"brace-open","kind":"structural","package":"lexlean.core"}},{"byte_end":115,"byte_start":109,"kind":"word","origin":{"kind":"renderer-token","token":"amsthm"}},{"byte_end":116,"byte_start":115,"kind":"delimiter","origin":{"entry":"brace-close","kind":"structural","package":"lexlean.core"}},{"byte_end":128,"byte_start":117,"kind":"control","origin":{"kind":"renderer-token","token":"usepackage"}},{"byte_end":129,"byte_start":128,"kind":"punctuation","origin":{"kind":"renderer-token","token":"left-bracket"}},{"byte_end":138,"byte_start":129,"kind":"word","origin":{"kind":"renderer-token","token":"hidelinks"}},{"byte_end":139,"byte_start":138,"kind":"punctuation","origin":{"kind":"renderer-token","token":"right-bracket"}},{"byte_end":140,"byte_start":139,"kind":"delimiter","origin":{"entry":"brace-open","kind":"structural","package":"lexlean.core"}},{"byte_end":148,"byte_start":140,"kind":"word","origin":{"kind":"renderer-token","token":"hyperref"}},{"byte_end":149,"byte_start":148,"kind":"delimiter","origin":{"entry":"brace-close","kind":"structural","package":"lexlean.core"}},{"byte_end":161,"byte_start":150,"kind":"control","origin":{"kind":"renderer-token","token":"newtheorem"}},{"byte_end":162,"byte_start":161,"kind":"delimiter","origin":{"entry":"brace-open","kind":"structural","package":"lexlean.core"}},{"byte_end":169,"byte_start":162,"kind":"word","origin":{"kind":"renderer-token","token":"theorem"}},{"byte_end":170,"byte_start":169,"kind":"delimiter","origin":{"entry":"brace-close","kind":"structural","package":"lexlean.core"}},{"byte_end":171,"byte_start":170,"kind":"delimiter","origin":{"entry":"brace-open","kind":"structural","package":"lexlean.core"}},{"byte_end":178,"byte_start":171,"kind":"word","origin":{"kind":"renderer-token","token":"theorem-title"}},{"byte_end":179,"byte_start":178,"kind":"delimiter","origin":{"entry":"brace-close","kind":"structural","package":"lexlean.core"}},{"byte_end":180,"byte_start":179,"kind":"punctuation","origin":{"kind":"renderer-token","token":"left-bracket"}},{"byte_end":187,"byte_start":180,"kind":"word","origin":{"kind":"renderer-token","token":"section-counter"}},{"byte_end":188,"byte_start":187,"kind":"punctuation","origin":{"kind":"renderer-token","token":"right-bracket"}},{"byte_end":200,"byte_start":189,"kind":"control","origin":{"kind":"renderer-token","token":"newtheorem"}},{"byte_end":201,"byte_start":200,"kind":"delimiter","origin":{"entry":"brace-open","kind":"structural","package":"lexlean.core"}},{"byte_end":206,"byte_start":201,"kind":"word","origin":{"kind":"renderer-token","token":"lemma"}},{"byte_end":207,"byte_start":206,"kind":"delimiter","origin":{"entry":"brace-close","kind":"structural","package":"lexlean.core"}},{"byte_end":208,"byte_start":207,"kind":"punctuation","origin":{"kind":"renderer-token","token":"left-bracket"}},{"byte_end":215,"byte_start":208,"kind":"word","origin":{"kind":"renderer-token","token":"theorem"}},{"byte_end":216,"byte_start":215,"kind":"punctuation","origin":{"kind":"renderer-token","token":"right-bracket"}},{"byte_end":217,"byte_start":216,"kind":"delimiter","origin":{"entry":"brace-open","kind":"structural","package":"lexlean.core"}},{"byte_end":222,"byte_start":217,"kind":"word","origin":{"kind":"renderer-token","token":"lemma-title"}},{"byte_end":223,"byte_start":222,"kind":"delimiter","origin":{"entry":"brace-close","kind":"structural","package":"lexlean.core"}},{"byte_end":235,"byte_start":224,"kind":"control","origin":{"kind":"renderer-token","token":"newtheorem"}},{"byte_end":236,"byte_start":235,"kind":"delimiter","origin":{"entry":"brace-open","kind":"structural","package":"lexlean.core"}},{"byte_end":245,"byte_start":236,"kind":"word","origin":{"kind":"renderer-token","token":"corollary"}},{"byte_end":246,"byte_start":245,"kind":"delimiter","origin":{"entry":"brace-close","kind":"structural","package":"lexlean.core"}},{"byte_end":247,"byte_start":246,"kind":"punctuation","origin":{"kind":"renderer-token","token":"left-bracket"}},{"byte_end":254,"byte_start":247,"kind":"word","origin":{"kind":"renderer-token","token":"theorem"}},{"byte_end":255,"byte_start":254,"kind":"punctuation","origin":{"kind":"renderer-token","token":"right-bracket"}},{"byte_end":256,"byte_start":255,"kind":"delimiter","origin":{"entry":"brace-open","kind":"structural","package":"lexlean.core"}},{"byte_end":265,"byte_start":256,"kind":"word","origin":{"kind":"renderer-token","token":"corollary-title"}},{"byte_end":266,"byte_start":265,"kind":"delimiter","origin":{"entry":"brace-close","kind":"structural","package":"lexlean.core"}},{"byte_end":280,"byte_start":267,"kind":"control","origin":{"kind":"renderer-token","token":"theoremstyle"}},{"byte_end":281,"byte_start":280,"kind":"delimiter","origin":{"entry":"brace-open","kind":"structural","package":"lexlean.core"}},{"byte_end":291,"byte_start":281,"kind":"word","origin":{"kind":"renderer-token","token":"definition"}},{"byte_end":292,"byte_start":291,"kind":"delimiter","origin":{"entry":"brace-close","kind":"structural","package":"lexlean.core"}},{"byte_end":304,"byte_start":293,"kind":"control","origin":{"kind":"renderer-token","token":"newtheorem"}},{"byte_end":305,"byte_start":304,"kind":"delimiter","origin":{"entry":"brace-open","kind":"structural","package":"lexlean.core"}},{"byte_end":315,"byte_start":305,"kind":"word","origin":{"kind":"renderer-token","token":"definition"}},{"byte_end":316,"byte_start":315,"kind":"delimiter","origin":{"entry":"brace-close","kind":"structural","package":"lexlean.core"}},{"byte_end":317,"byte_start":316,"kind":"punctuation","origin":{"kind":"renderer-token","token":"left-bracket"}},{"byte_end":324,"byte_start":317,"kind":"word","origin":{"kind":"renderer-token","token":"theorem"}},{"byte_end":325,"byte_start":324,"kind":"punctuation","origin":{"kind":"renderer-token","token":"right-bracket"}},{"byte_end":326,"byte_start":325,"kind":"delimiter","origin":{"entry":"brace-open","kind":"structural","package":"lexlean.core"}},{"byte_end":336,"byte_start":326,"kind":"word","origin":{"kind":"renderer-token","token":"definition-title"}},{"byte_end":337,"byte_start":336,"kind":"delimiter","origin":{"entry":"brace-close","kind":"structural","package":"lexlean.core"}},{"byte_end":344,"byte_start":338,"kind":"control","origin":{"kind":"renderer-token","token":"begin"}},{"byte_end":345,"byte_start":344,"kind":"delimiter","origin":{"entry":"brace-open","kind":"structural","package":"lexlean.core"}},{"byte_end":353,"byte_start":345,"kind":"word","origin":{"kind":"renderer-token","token":"document"}},{"byte_end":354,"byte_start":353,"kind":"delimiter","origin":{"entry":"brace-close","kind":"structural","package":"lexlean.core"}},{"byte_end":361,"byte_start":355,"kind":"control","origin":{"kind":"renderer-token","token":"begin"}},{"byte_end":362,"byte_start":361,"kind":"delimiter","origin":{"entry":"brace-open","kind":"structural","package":"lexlean.core"}},{"byte_end":368,"byte_start":362,"kind":"word","origin":{"kind":"renderer-token","token":"center"}},{"byte_end":369,"byte_start":368,"kind":"delimiter","origin":{"entry":"brace-close","kind":"structural","package":"lexlean.core"}},{"byte_end":371,"byte_start":370,"kind":"delimiter","origin":{"entry":"brace-open","kind":"structural","package":"lexlean.core"}},{"byte_end":377,"byte_start